<?xml version="1.0" encoding="UTF-8"?>
<religion xmlns:xsi="http://www.w3.org/2001/XMLSchema-instance"
	xsi:noNamespaceSchemaLocation="..\..\validation\religion.xsd">
	<name>test_religion</name>
	<traits>
		<trait>chaste</trait>
		<trait>honest</trait>
		<trait>just</trait>
		<trait>merciful</trait>
		<trait>temperate</trait>
	</traits>
	<bonus>
		<derived_attributes>
			<derived_attribute>
				<name>damage_bonus</name>
				<value>3</value>
			</derived_attribute>
			<derived_attribute>
				<name>hitpoints</name>
				<value>2</value>
			</derived_attribute>
		</derived_attributes>
		<armor_bonus>5</armor_bonus>
		<damage_bonus>6</damage_bonus>
		<damage_dice_bonus>7</damage_dice_bonus>
	</bonus>
</religion>
